{
  "$schema": "https://json-schema.org/draft/2020-12/schema",
  "$id": "https://contracts.indexshelf.dev/data/v1/commands/cancel-job.schema.json",
  "title": "Cancel Job Command",
  "type": "object",
  "additionalProperties": false,
  "allOf": [{ "$ref": "../common/event-envelope.schema.json" }],
  "required": ["message_id", "message_kind", "message_type", "message_version", "occurred_at", "correlation_id", "producer", "subject", "payload"],
  "properties": {
    "message_id": { "type": "string", "format": "uuid" },
    "message_kind": { "const": "command" },
    "message_type": { "const": "job.cancel" },
    "message_version": { "const": 1 },
    "occurred_at": { "type": "string", "format": "date-time", "pattern": "^\\d{4}-\\d{2}-\\d{2}T\\d{2}:\\d{2}:\\d{2}(?:\\.\\d{1,6})?Z$" },
    "correlation_id": { "type": "string", "format": "uuid" },
    "causation_id": { "type": ["string", "null"], "format": "uuid" },
    "producer": { "const": "backend" },
    "subject": { "type": "object", "additionalProperties": false, "required": ["kind", "id"], "properties": { "kind": { "const": "job" }, "id": { "type": "string", "format": "uuid" } } },
    "payload": {
      "type": "object",
      "additionalProperties": false,
      "required": ["job_id", "reason"],
      "properties": {
        "job_id": { "type": "string", "format": "uuid" },
        "reason": { "type": "string", "enum": ["user_requested", "superseded", "policy"] }
      }
    }
  }
}
