{
  "message_id": "00000000-0000-4000-8000-000000000001",
  "message_kind": "command",
  "message_type": "job.cancel",
  "message_version": 1,
  "occurred_at": "2026-09-07T10:00:00Z",
  "correlation_id": "00000000-0000-4000-8000-000000000002",
  "causation_id": null,
  "producer": "backend",
  "subject": { "kind": "job", "id": "00000000-0000-4000-8000-000000000003" },
  "payload": { "job_id": "00000000-0000-4000-8000-000000000003", "reason": "user_requested" }
}
